{
  "$schema": "https://json-schema.org/draft/2020-12/schema",
  "$id": "https://heros-agent.dev/schemas/workflow-ir.schema.json",
  "title": "Workflow IR",
  "description": "The canonical intermediate representation of a discovered LLM workflow: a versioned graph of static node definitions and typed edges. Emitted by Discovery (P1); consumed by the Config Layer (P2), Pattern Classifier (P3.5), Eval (P4), Re-arrangement (P5), and the graph UI. Frozen at M0. See docs/prd/P0-foundations.md and openspec/changes/p0-foundations.",
  "x-frozen": { "milestone": "M0", "policy": "additive-only", "record": "docs/decisions/m0-review-and-freeze.md" },
  "type": "object",
  "$comment": "ir_version is the semantic version of THIS schema (the IR contract), not of the source repo. Referential integrity (every edge endpoint and every runtime-invocation node_id must reference an existing node) is a semantic check performed by CI beyond JSON Schema's expressive power; JSON Schema here validates structure and required fields only.",
  "required": ["ir_version", "workflow", "nodes", "edges"],
  "additionalProperties": false,
  "properties": {
    "ir_version": {
      "type": "string",
      "description": "Semver of the Workflow IR schema. Adding an optional field bumps MINOR; removing/renaming a field or making an optional field required bumps MAJOR (NFR1, additive evolution).",
      "pattern": "^[0-9]+\\.[0-9]+\\.[0-9]+$"
    },
    "workflow": {
      "type": "object",
      "description": "Identity of the source workflow the IR was extracted from.",
      "required": ["id", "repo", "language"],
      "additionalProperties": false,
      "properties": {
        "id": {
          "type": "string",
          "description": "Stable identifier for this workflow within the platform.",
          "minLength": 1
        },
        "repo": {
          "type": "object",
          "required": ["url", "commit_sha"],
          "additionalProperties": false,
          "properties": {
            "url": { "type": "string", "minLength": 1 },
            "commit_sha": {
              "type": "string",
              "description": "Exact commit the IR was extracted from; part of what makes an IR diffable and reproducible.",
              "pattern": "^[0-9a-fA-F]{7,64}$"
            }
          }
        },
        "language": {
          "type": "string",
          "description": "Primary source language of the workflow (e.g. python, typescript, go).",
          "minLength": 1
        }
      }
    },
    "nodes": {
      "type": "array",
      "description": "Static node definitions. Node COUNT is the length of this array (per-definition count); a definition with variable runtime fan-out is flagged variable_at_runtime, never expanded into multiple nodes (FR4).",
      "items": { "$ref": "#/$defs/Node" }
    },
    "edges": {
      "type": "array",
      "description": "Typed edges between static node definitions.",
      "items": { "$ref": "#/$defs/Edge" }
    },
    "subgraphs": {
      "type": "array",
      "description": "Optional. Named subgraphs (a set of node_ids) for per-subgraph pattern labelling. Unset in P0/P1; populated by the P3.5 Pattern Classifier, which labels SUBGRAPHS (nodes and/or subgraphs — FR7). Absence never invalidates an IR; adding it is additive (no MAJOR bump).",
      "items": { "$ref": "#/$defs/Subgraph" }
    }
  },
  "$defs": {
    "Node": {
      "type": "object",
      "title": "Static node definition",
      "description": "One discovered LLM call site. Exposes every dimension the Config Layer can override.",
      "required": [
        "node_id",
        "kind",
        "call_site",
        "model",
        "prompt",
        "tools_skills",
        "context_assembly",
        "io_contract",
        "invocation_semantics"
      ],
      "additionalProperties": false,
      "properties": {
        "node_id": {
          "type": "string",
          "description": "Stable identifier derived deterministically from the call site, so two Discovery runs over the same commit produce the same node_id (diffability).",
          "minLength": 1
        },
        "kind": {
          "const": "static_definition",
          "description": "A node is always a static definition. Runtime execution instances are runtime-invocation records (see runtime-invocation.schema.json), not nodes."
        },
        "call_site": {
          "type": "object",
          "description": "Precise source anchor, sufficient for a later phase (P2 codemod) to rewrite the call site.",
          "required": ["file", "symbol", "line_start", "line_end"],
          "additionalProperties": false,
          "properties": {
            "file": { "type": "string", "minLength": 1 },
            "symbol": {
              "type": "string",
              "description": "Enclosing function/method/symbol containing the call site.",
              "minLength": 1
            },
            "line_start": { "type": "integer", "minimum": 1 },
            "line_end": { "type": "integer", "minimum": 1 },
            "ast_path": {
              "type": "string",
              "description": "Optional structured path to the call expression in the AST, for robust rewrites across formatting changes."
            }
          }
        },
        "model": {
          "type": "object",
          "description": "The current/observed model binding at this call site.",
          "required": ["provider", "model_id", "params"],
          "additionalProperties": false,
          "properties": {
            "provider": { "type": "string", "minLength": 1 },
            "model_id": { "type": "string", "minLength": 1 },
            "params": {
              "type": "object",
              "description": "Inference parameters (temperature, max_tokens, top_p, ...). Free-form; part of the config_hash include set.",
              "additionalProperties": true
            }
          }
        },
        "prompt": {
          "type": "object",
          "description": "The prompt at this call site: a registry template reference OR inline text, plus the declared variable slots.",
          "required": ["variables"],
          "additionalProperties": false,
          "oneOf": [
            { "required": ["template_ref"] },
            { "required": ["inline"] }
          ],
          "properties": {
            "template_ref": {
              "type": "string",
              "description": "Reference to a versioned prompt-registry entry. Mutually exclusive with inline.",
              "minLength": 1
            },
            "inline": {
              "type": "string",
              "description": "Inline prompt text. Large prompts SHOULD be content-hashed to the blob store and referenced; see storage decision record."
            },
            "variables": {
              "type": "array",
              "description": "Declared variable slots the prompt interpolates.",
              "items": { "type": "string", "minLength": 1 }
            }
          }
        },
        "tools_skills": {
          "type": "array",
          "description": "Bound tool/skill names available at this call site.",
          "items": { "type": "string", "minLength": 1 }
        },
        "context_assembly": {
          "type": "object",
          "description": "How context is built for this call (RAG policy, message-window strategy, etc.).",
          "required": ["policy", "description"],
          "additionalProperties": false,
          "properties": {
            "policy": { "type": "string", "minLength": 1 },
            "description": { "type": "string" }
          }
        },
        "io_contract": {
          "$ref": "#/$defs/IOContract"
        },
        "invocation_semantics": {
          "type": "object",
          "description": "Whether this definition fires once or a variable number of times at runtime.",
          "required": ["type", "variable_at_runtime"],
          "additionalProperties": false,
          "properties": {
            "type": {
              "enum": ["single", "loop", "conditional"],
              "description": "single: fires once per case. loop: agent/iteration with runtime-variable count. conditional: fires zero-or-once depending on a runtime branch."
            },
            "variable_at_runtime": {
              "type": "boolean",
              "description": "true when the number of runtime LLM calls is not statically fixed (loops, conditional agents). Such a node is still exactly ONE node in the graph (FR4)."
            }
          }
        },
        "pattern_labels": {
          "$ref": "#/$defs/PatternLabels"
        }
      }
    },
    "IOContract": {
      "type": "object",
      "title": "Typed per-node I/O contract",
      "description": "Required from IR v1 (FR5). Each of input_schema/output_schema is an embedded JSON Schema (draft 2020-12) describing the node's input/output shape. Early schemas MAY be permissive (e.g. {\"type\":\"object\"}) when static analysis cannot fully infer the shape; refining precision later is an additive change and does NOT bump ir_version MAJOR.",
      "required": ["input_schema", "output_schema"],
      "additionalProperties": false,
      "properties": {
        "input_schema": {
          "type": "object",
          "$comment": "An embedded JSON Schema 2020-12 document. Kept as a generic object here because JSON Schema cannot fully validate that arbitrary embedded content is itself a valid schema; a CI meta-validation step checks it compiles."
        },
        "output_schema": {
          "type": "object",
          "$comment": "An embedded JSON Schema 2020-12 document; see input_schema."
        }
      }
    },
    "PatternLabels": {
      "type": "array",
      "title": "Reserved pattern labels (P3.5)",
      "description": "Optional. Unset in P0/P1; populated by the P3.5 Pattern Classifier. Absence never invalidates an IR (FR7).",
      "items": {
        "type": "object",
        "required": ["pattern", "confidence"],
        "additionalProperties": false,
        "properties": {
          "pattern": {
            "type": "string",
            "description": "A pattern name from the fixed 20-pattern taxonomy (defined in P3.5).",
            "minLength": 1
          },
          "confidence": {
            "type": "number",
            "minimum": 0,
            "maximum": 1
          }
        }
      }
    },
    "Subgraph": {
      "type": "object",
      "title": "Subgraph (P3.5 pattern-labelling unit)",
      "description": "A named set of node_ids the P3.5 classifier labels with agentic pattern(s). P3.5 emits a SET of labels tied to the specific subgraph — never one label for the whole workflow. Optional and reserved: unset in P0/P1.",
      "required": ["subgraph_id", "node_ids"],
      "additionalProperties": false,
      "properties": {
        "subgraph_id": {
          "type": "string",
          "description": "Stable identifier for this subgraph.",
          "minLength": 1
        },
        "node_ids": {
          "type": "array",
          "description": "The node_ids composing this subgraph (each references a node in the nodes array; referential integrity checked in CI).",
          "items": { "type": "string", "minLength": 1 },
          "minItems": 1
        },
        "pattern_labels": {
          "$ref": "#/$defs/PatternLabels"
        }
      }
    },
    "Edge": {
      "type": "object",
      "description": "A typed edge between two static node definitions. Both endpoints reference existing node_ids (referential integrity checked in CI).",
      "required": ["from_node_id", "to_node_id", "kind"],
      "additionalProperties": false,
      "properties": {
        "from_node_id": { "type": "string", "minLength": 1 },
        "to_node_id": { "type": "string", "minLength": 1 },
        "kind": {
          "enum": ["data", "control"],
          "description": "data: producer output feeds consumer input. control: a router/condition activates the target without passing data."
        }
      }
    }
  }
}
