{
  "ir_version": "1.0.0",
  "workflow": {
    "id": "workflow",
    "repo": {
      "url": "local://java",
      "commit_sha": "0000000"
    },
    "language": "java"
  },
  "nodes": [
    {
      "node_id": "n_cf094ef664d8af99",
      "kind": "static_definition",
      "call_site": {
        "file": "Svc.java",
        "symbol": "\u003cfile\u003e.Svc.run",
        "line_start": 4,
        "line_end": 4,
        "ast_path": "\u003cfile\u003e.Svc.run/generate"
      },
      "model": {
        "provider": "unresolved",
        "model_id": "unresolved",
        "params": {}
      },
      "prompt": {
        "inline": "",
        "variables": []
      },
      "tools_skills": [],
      "context_assembly": {
        "policy": "inline_messages",
        "description": "static call site (syntactic frontend; no type resolution)"
      },
      "io_contract": {
        "input_schema": {
          "type": "object"
        },
        "output_schema": {
          "type": "object"
        }
      },
      "invocation_semantics": {
        "type": "single",
        "variable_at_runtime": false
      }
    }
  ],
  "edges": []
}
