{
  "ir_version": "1.0.0",
  "workflow": {
    "id": "example.com/sample",
    "repo": {
      "url": "local://samplerepo",
      "commit_sha": "0000000"
    },
    "language": "go"
  },
  "nodes": [
    {
      "node_id": "n_68fcfb1cd916ed9b",
      "kind": "static_definition",
      "call_site": {
        "file": "main.go",
        "symbol": "main",
        "line_start": 7,
        "line_end": 7,
        "ast_path": "main/Messages.New"
      },
      "model": {
        "provider": "anthropic",
        "model_id": "unresolved",
        "params": {}
      },
      "prompt": {
        "inline": "",
        "variables": []
      },
      "tools_skills": [],
      "context_assembly": {
        "policy": "inline_messages",
        "description": "static message list at the call site"
      },
      "io_contract": {
        "input_schema": {
          "type": "object"
        },
        "output_schema": {
          "type": "object"
        }
      },
      "invocation_semantics": {
        "type": "single",
        "variable_at_runtime": false
      }
    }
  ],
  "edges": []
}
