{
  "ir_version": "1.0.0",
  "workflow": {
    "id": "workflow",
    "repo": {
      "url": "local://rust",
      "commit_sha": "0000000"
    },
    "language": "rust"
  },
  "nodes": [
    {
      "node_id": "n_166f2eff6353ae4f",
      "kind": "static_definition",
      "call_site": {
        "file": "src/main.rs",
        "symbol": "ask",
        "line_start": 3,
        "line_end": 3,
        "ast_path": "ask/chat.create"
      },
      "model": {
        "provider": "openai",
        "model_id": "unresolved",
        "params": {}
      },
      "prompt": {
        "inline": "",
        "variables": []
      },
      "tools_skills": [],
      "context_assembly": {
        "policy": "inline_messages",
        "description": "static call site (syntactic frontend; no type resolution)"
      },
      "io_contract": {
        "input_schema": {
          "type": "object"
        },
        "output_schema": {
          "type": "object"
        }
      },
      "invocation_semantics": {
        "type": "single",
        "variable_at_runtime": false
      }
    },
    {
      "node_id": "n_5d68e1e8633af1f9",
      "kind": "static_definition",
      "call_site": {
        "file": "src/main.rs",
        "symbol": "ask",
        "line_start": 4,
        "line_end": 4,
        "ast_path": "ask/chat.create"
      },
      "model": {
        "provider": "openai",
        "model_id": "unresolved",
        "params": {}
      },
      "prompt": {
        "inline": "",
        "variables": []
      },
      "tools_skills": [],
      "context_assembly": {
        "policy": "inline_messages",
        "description": "static call site (syntactic frontend; no type resolution)"
      },
      "io_contract": {
        "input_schema": {
          "type": "object"
        },
        "output_schema": {
          "type": "object"
        }
      },
      "invocation_semantics": {
        "type": "loop",
        "variable_at_runtime": true
      }
    }
  ],
  "edges": []
}
