{
  "ir_version": "1.0.0",
  "workflow": {
    "id": "example.com/mixed",
    "repo": {
      "url": "local://mixed",
      "commit_sha": "0000000"
    },
    "language": "mixed"
  },
  "nodes": [
    {
      "node_id": "n_1f6d129b2ed1ccc1",
      "kind": "static_definition",
      "call_site": {
        "file": "svc/triage.py",
        "symbol": "classify",
        "line_start": 6,
        "line_end": 6,
        "ast_path": "classify/messages.create"
      },
      "model": {
        "provider": "anthropic",
        "model_id": "claude-sonnet-4-5",
        "params": {}
      },
      "prompt": {
        "inline": "",
        "variables": []
      },
      "tools_skills": [],
      "context_assembly": {
        "policy": "inline_messages",
        "description": "static call site (syntactic frontend; no type resolution)"
      },
      "io_contract": {
        "input_schema": {
          "type": "object"
        },
        "output_schema": {
          "type": "object"
        }
      },
      "invocation_semantics": {
        "type": "single",
        "variable_at_runtime": false
      }
    },
    {
      "node_id": "n_e49f719e89e49c60",
      "kind": "static_definition",
      "call_site": {
        "file": "svc/web.ts",
        "symbol": "ask",
        "line_start": 4,
        "line_end": 4,
        "ast_path": "ask/chat.completions.create"
      },
      "model": {
        "provider": "openai",
        "model_id": "gpt-4o",
        "params": {}
      },
      "prompt": {
        "inline": "",
        "variables": []
      },
      "tools_skills": [],
      "context_assembly": {
        "policy": "inline_messages",
        "description": "static call site (syntactic frontend; no type resolution)"
      },
      "io_contract": {
        "input_schema": {
          "type": "object"
        },
        "output_schema": {
          "type": "object"
        }
      },
      "invocation_semantics": {
        "type": "single",
        "variable_at_runtime": false
      }
    },
    {
      "node_id": "n_e97cb4e1d99d93ae",
      "kind": "static_definition",
      "call_site": {
        "file": "main.go",
        "symbol": "main",
        "line_start": 7,
        "line_end": 7,
        "ast_path": "main/Messages.New"
      },
      "model": {
        "provider": "anthropic",
        "model_id": "anthropic.ModelClaudeOpus4_6",
        "params": {}
      },
      "prompt": {
        "inline": "",
        "variables": []
      },
      "tools_skills": [],
      "context_assembly": {
        "policy": "inline_messages",
        "description": "static message list at the call site"
      },
      "io_contract": {
        "input_schema": {
          "type": "object"
        },
        "output_schema": {
          "type": "object"
        }
      },
      "invocation_semantics": {
        "type": "single",
        "variable_at_runtime": false
      }
    }
  ],
  "edges": []
}
