{
  "ir_version": "1.0.0",
  "workflow": {
    "id": "support-triage-agent",
    "repo": {
      "url": "https://github.com/example/support-triage",
      "commit_sha": "9f1c2ab"
    },
    "language": "python"
  },
  "nodes": [
    {
      "node_id": "classify_intent@app/triage.py:classify:41",
      "kind": "static_definition",
      "call_site": {
        "file": "app/triage.py",
        "symbol": "classify",
        "line_start": 41,
        "line_end": 58,
        "ast_path": "Module/FunctionDef[classify]/Assign/Call[client.chat.completions.create]"
      },
      "model": {
        "provider": "openai",
        "model_id": "gpt-4o-mini",
        "params": { "temperature": 0, "max_tokens": 256 }
      },
      "prompt": {
        "template_ref": "prompt://triage/classify@3",
        "variables": ["ticket_text"]
      },
      "tools_skills": [],
      "context_assembly": {
        "policy": "single_message",
        "description": "Ticket body passed as the sole user message; no retrieval."
      },
      "io_contract": {
        "input_schema": {
          "type": "object",
          "properties": { "ticket_text": { "type": "string" } },
          "required": ["ticket_text"]
        },
        "output_schema": {
          "type": "object",
          "properties": { "intent": { "type": "string", "enum": ["billing", "bug", "how_to", "other"] } },
          "required": ["intent"]
        }
      },
      "invocation_semantics": { "type": "single", "variable_at_runtime": false }
    },
    {
      "node_id": "resolve_agent@app/triage.py:resolve:77",
      "kind": "static_definition",
      "call_site": {
        "file": "app/triage.py",
        "symbol": "resolve",
        "line_start": 77,
        "line_end": 120
      },
      "model": {
        "provider": "anthropic",
        "model_id": "claude-sonnet-5",
        "params": { "temperature": 0.2, "max_tokens": 1024 }
      },
      "prompt": {
        "inline": "You are a support agent. Use the tools to resolve the ticket classified as {intent}.",
        "variables": ["intent"]
      },
      "tools_skills": ["search_kb", "issue_lookup"],
      "context_assembly": {
        "policy": "tool_loop",
        "description": "ReAct-style loop: model calls tools until it emits a final answer."
      },
      "io_contract": {
        "input_schema": { "type": "object" },
        "output_schema": {
          "type": "object",
          "properties": { "resolution": { "type": "string" } },
          "required": ["resolution"]
        }
      },
      "invocation_semantics": { "type": "loop", "variable_at_runtime": true }
    }
  ],
  "edges": [
    {
      "from_node_id": "classify_intent@app/triage.py:classify:41",
      "to_node_id": "resolve_agent@app/triage.py:resolve:77",
      "kind": "data"
    }
  ]
}
