{
  "ir_version": "1.0.0",
  "workflow": {
    "id": "support-triage-agent",
    "repo": { "url": "https://github.com/example/support-triage", "commit_sha": "9f1c2ab" },
    "language": "python"
  },
  "nodes": [
    {
      "node_id": "classify_intent@app/triage.py:classify:41",
      "kind": "static_definition",
      "call_site": { "file": "app/triage.py", "symbol": "classify", "line_start": 41, "line_end": 58 },
      "model": { "provider": "openai", "model_id": "gpt-4o-mini", "params": { "temperature": 0 } },
      "prompt": { "template_ref": "prompt://triage/classify@3", "variables": ["ticket_text"] },
      "tools_skills": [],
      "context_assembly": { "policy": "single_message", "description": "Ticket body as sole user message." },
      "io_contract": { "input_schema": { "type": "object" }, "output_schema": { "type": "object" } },
      "invocation_semantics": { "type": "single", "variable_at_runtime": false },
      "pattern_labels": [
        { "pattern": "router", "confidence": 0.82 }
      ]
    },
    {
      "node_id": "resolve_agent@app/triage.py:resolve:77",
      "kind": "static_definition",
      "call_site": { "file": "app/triage.py", "symbol": "resolve", "line_start": 77, "line_end": 120 },
      "model": { "provider": "anthropic", "model_id": "claude-sonnet-5", "params": { "temperature": 0.2 } },
      "prompt": { "inline": "Resolve the ticket classified as {intent}.", "variables": ["intent"] },
      "tools_skills": ["search_kb", "issue_lookup"],
      "context_assembly": { "policy": "tool_loop", "description": "ReAct loop until final answer." },
      "io_contract": { "input_schema": { "type": "object" }, "output_schema": { "type": "object" } },
      "invocation_semantics": { "type": "loop", "variable_at_runtime": true }
    }
  ],
  "edges": [
    { "from_node_id": "classify_intent@app/triage.py:classify:41", "to_node_id": "resolve_agent@app/triage.py:resolve:77", "kind": "data" }
  ],
  "subgraphs": [
    {
      "subgraph_id": "sg_resolve_toolloop",
      "node_ids": ["resolve_agent@app/triage.py:resolve:77"],
      "pattern_labels": [
        { "pattern": "tool_use", "confidence": 0.91 },
        { "pattern": "react", "confidence": 0.74 }
      ]
    }
  ]
}
