{
  "ir_version": "1.0.0",
  "workflow": {
    "id": "workflow",
    "repo": {
      "url": "local://kotlin",
      "commit_sha": "0000000"
    },
    "language": "kotlin"
  },
  "nodes": [
    {
      "node_id": "n_bcd52bbe29639a0d",
      "kind": "static_definition",
      "call_site": {
        "file": "app/Agent.kt",
        "symbol": "\u003cfile\u003e.Agent.classify",
        "line_start": 7,
        "line_end": 7,
        "ast_path": "\u003cfile\u003e.Agent.classify/generate"
      },
      "model": {
        "provider": "unresolved",
        "model_id": "unresolved",
        "params": {}
      },
      "prompt": {
        "inline": "",
        "variables": []
      },
      "tools_skills": [],
      "context_assembly": {
        "policy": "inline_messages",
        "description": "static call site (syntactic frontend; no type resolution)"
      },
      "io_contract": {
        "input_schema": {
          "type": "object"
        },
        "output_schema": {
          "type": "object"
        }
      },
      "invocation_semantics": {
        "type": "single",
        "variable_at_runtime": false
      }
    },
    {
      "node_id": "n_f5cd83ae0625abfa",
      "kind": "static_definition",
      "call_site": {
        "file": "app/Agent.kt",
        "symbol": "\u003cfile\u003e.Agent.batch",
        "line_start": 12,
        "line_end": 12,
        "ast_path": "\u003cfile\u003e.Agent.batch/generate"
      },
      "model": {
        "provider": "unresolved",
        "model_id": "unresolved",
        "params": {}
      },
      "prompt": {
        "inline": "",
        "variables": []
      },
      "tools_skills": [],
      "context_assembly": {
        "policy": "inline_messages",
        "description": "static call site (syntactic frontend; no type resolution)"
      },
      "io_contract": {
        "input_schema": {
          "type": "object"
        },
        "output_schema": {
          "type": "object"
        }
      },
      "invocation_semantics": {
        "type": "loop",
        "variable_at_runtime": true
      }
    }
  ],
  "edges": []
}
