{
  "ir_version": "1.0.0",
  "workflow": {
    "id": "workflow",
    "repo": {
      "url": "local://python",
      "commit_sha": "0000000"
    },
    "language": "python"
  },
  "nodes": [
    {
      "node_id": "n_2408b6ca75daf524",
      "kind": "static_definition",
      "call_site": {
        "file": "app/triage.py",
        "symbol": "agent",
        "line_start": 12,
        "line_end": 12,
        "ast_path": "agent/chat.completions.create"
      },
      "model": {
        "provider": "openai",
        "model_id": "gpt-4o",
        "params": {}
      },
      "prompt": {
        "inline": "",
        "variables": []
      },
      "tools_skills": [],
      "context_assembly": {
        "policy": "inline_messages",
        "description": "static call site (syntactic frontend; no type resolution)"
      },
      "io_contract": {
        "input_schema": {
          "type": "object"
        },
        "output_schema": {
          "type": "object"
        }
      },
      "invocation_semantics": {
        "type": "loop",
        "variable_at_runtime": true
      }
    },
    {
      "node_id": "n_7bbe8a3313a0400f",
      "kind": "static_definition",
      "call_site": {
        "file": "app/triage.py",
        "symbol": "classify",
        "line_start": 7,
        "line_end": 7,
        "ast_path": "classify/messages.create"
      },
      "model": {
        "provider": "anthropic",
        "model_id": "claude-sonnet-4-5",
        "params": {}
      },
      "prompt": {
        "inline": "",
        "variables": []
      },
      "tools_skills": [],
      "context_assembly": {
        "policy": "inline_messages",
        "description": "static call site (syntactic frontend; no type resolution)"
      },
      "io_contract": {
        "input_schema": {
          "type": "object"
        },
        "output_schema": {
          "type": "object"
        }
      },
      "invocation_semantics": {
        "type": "single",
        "variable_at_runtime": false
      }
    }
  ],
  "edges": []
}
